{
  "artifact_bindings": {
    "artifact_binding_root": "fb18ac44def1d820237d2b81b171d2d12d1c7d531a8e767fe783dac6522010fe",
    "artifact_count": 25,
    "bindings": [
      {
        "artifact_binding_hash": "cb70a7eac38de17ee7c23ab09e9b5ccd65f49030974fe2b0728b299a247b8d18",
        "declared_hash": "d599800e2308391b8f704109473b88ff3cd6015d4e2f7e2ff47dee325decb1c0",
        "hash_reproducible": true,
        "name": "certification_report",
        "payload_hash": "03666d7853858274398906517fefac71ba4a167319d0961c3723bbb1887b38a5",
        "present": true,
        "status": "passed",
        "target_level": "RDLLM-L149",
        "version": "rdllm-certification/v1"
      },
      {
        "artifact_binding_hash": "7649e225af391c89910328d40203fc3c138d30cb7569db57514adf0aeed90001",
        "declared_hash": "2ff0f2ca950004b76c1714009eb10de0cc755259220a671ac99eac5c2353b3ad",
        "hash_reproducible": true,
        "name": "certification_attestation",
        "payload_hash": "ef6bcb2464c22525143ebd4bc8a60bc85ba963f1d14ad43e13ac731dcbe4d9a6",
        "present": true,
        "status": "attested",
        "target_level": "RDLLM-L52",
        "version": "rdllm-certification-attestation/v1"
      },
      {
        "artifact_binding_hash": "fe7a24905363f26a7c09f329802d86f9364947ca633afbe926640ad867d49faf",
        "declared_hash": "e8d6f85e21173912cca2d50207282bdebe981b57a3d4c89be77d5ab89fc07468",
        "hash_reproducible": true,
        "name": "provider_attribution_card",
        "payload_hash": "9888ce48930b16731a45c64fb8631319e431799f13df5714ba37743368e28411",
        "present": true,
        "status": "",
        "target_level": "",
        "version": "rdllm-provider-attribution-card/v1"
      },
      {
        "artifact_binding_hash": "c5f85e563212d0328fb7ea7da70a5dfedd3078acfe8692b87f2ae46af76b1d75",
        "declared_hash": "f51135dd736651781b9a6f841ba0557b2f27089edc80345acc0cdaaaa17e3bcc",
        "hash_reproducible": true,
        "name": "integration_profile",
        "payload_hash": "f97d599492715e71ae133ba8c6caf876addc95d24dd17f7550eefdd8d284057d",
        "present": true,
        "status": "ready",
        "target_level": "",
        "version": "rdllm-integration-profile/v1"
      },
      {
        "artifact_binding_hash": "6931fdd3b6155bf0a106f0e420b60b6a7de2037cd98a641a4b45c2734cdf6b3c",
        "declared_hash": "e1adcbca03b0f88027e7188d753c57fd6f580025a8170de3fa3af792d867acae",
        "hash_reproducible": true,
        "name": "discovery_manifest",
        "payload_hash": "a4082c524b34b22860cf261e7e4bac17844bf414ee9dee6629e119a5f1bbf92d",
        "present": true,
        "status": "ready",
        "target_level": "RDLLM-L149",
        "version": "rdllm-discovery-manifest/v1"
      },
      {
        "artifact_binding_hash": "5e7bf8bd93f4c91afe32adf02ca45ee9dda94665ad00defbd75995b7f087ee53",
        "declared_hash": "d24e99cee4a2ef88fad533180e767d115bc55cc9e057278b3b44adfbf5df3bee",
        "hash_reproducible": true,
        "name": "assurance_bundle",
        "payload_hash": "b74837b87a468088b1b17d307c5e140bf1a3cddeae65019d3b3674e7a8bdf8a8",
        "present": true,
        "status": "",
        "target_level": "",
        "version": "rdllm-assurance-bundle/v1"
      },
      {
        "artifact_binding_hash": "2b45d6e3cef3ab3111fb27e25dde198f974076c9d3bd3fe8b8731142dfc5c243",
        "declared_hash": "f890782c32bcad97036de11019ef8506af57831436f9396a5e4dd68087e23c59",
        "hash_reproducible": true,
        "name": "proof_dependency_graph",
        "payload_hash": "d1aaa5180467a247280759c37d51fabee170ed0370e7d96555297aa0bb1a37c6",
        "present": true,
        "status": "ready",
        "target_level": "RDLLM-L149",
        "version": "rdllm-proof-dependency-graph/v1"
      },
      {
        "artifact_binding_hash": "f447058ee3d843a2bddfa75a72be8da1cceab1bc5fb73c578893d84fe4502dbe",
        "declared_hash": "cef2902c79515d35f166ccc06043c16c43519a4eb95e2504d872d29d96478280",
        "hash_reproducible": true,
        "name": "universal_training_serving_contract",
        "payload_hash": "53bb198e150d39560e81f48e073e174224bdec4b60f3096ed785076f76c47273",
        "present": true,
        "status": "ready",
        "target_level": "RDLLM-L143",
        "version": "rdllm-universal-training-serving-contract/v1"
      },
      {
        "artifact_binding_hash": "221f8a2d0b09cc3ab6426ca9e7ffa818767d2bc93d8e70a6231745ac9c59e8e9",
        "declared_hash": "9a4834ea496702876fe6db85bacc652f79ca7c44f17e8d96c3e38e511fbb6c85",
        "hash_reproducible": true,
        "name": "universal_confidential_attribution_audit",
        "payload_hash": "d981946ec370ec17b7af924aa54a74a60c0e07d6344f30f900e44bb49b1852e4",
        "present": true,
        "status": "ready",
        "target_level": "RDLLM-L144",
        "version": "rdllm-universal-confidential-attribution-audit/v1"
      },
      {
        "artifact_binding_hash": "057ec959c18b918354b96d9d53fd5b412cfbc67293fef705ca4944edd89b3398",
        "declared_hash": "6b95d7c518c5779fdbc77b80e818b1600d7ecf02ef06bfcc3e8b9fc85d62ca89",
        "hash_reproducible": true,
        "name": "universal_attribution_authority_control_plane",
        "payload_hash": "3b2411327bf465fecead0560f744c0daadedd7f4c5181e88fb5cd937a489ad2c",
        "present": true,
        "status": "ready",
        "target_level": "RDLLM-L145",
        "version": "rdllm-universal-attribution-authority-control-plane/v1"
      },
      {
        "artifact_binding_hash": "c572f03a9aaadc2187495a7e6b4046274bab707c5e7dbe781a5554ae42be7e69",
        "declared_hash": "99ca228f5ab90dbdc6568d335b9a5ada916d6ba5b664d6dbadf84a9a896b1a2b",
        "hash_reproducible": true,
        "name": "universal_context_provenance_bridge",
        "payload_hash": "a8d5364dfb4d473d824adbbdb305b6f6c526d02af122e8d70796732d909157b5",
        "present": true,
        "status": "ready",
        "target_level": "RDLLM-L140",
        "version": "rdllm-universal-context-provenance-bridge/v1"
      },
      {
        "artifact_binding_hash": "d149ceec92783ab9e64ffcdf670a2a807e2832915c42d6acf19821198d555d3b",
        "declared_hash": "02f3172634a1ec03a81c458b57250114c53b1a58056a5b4710f1c63b4e768599",
        "hash_reproducible": true,
        "name": "universal_citation_verification_contract",
        "payload_hash": "ccd503298ca5f44653c61f69f33c2ddae7925bc732ea3303317d5f11a126c941",
        "present": true,
        "status": "ready",
        "target_level": "RDLLM-L141",
        "version": "rdllm-universal-citation-verification-contract/v1"
      },
      {
        "artifact_binding_hash": "f795a01c775943c37887a6a113ea269e34bd60c32cd454f8501fa82c84c67460",
        "declared_hash": "22848d36987d3822e827a99185d87268ea34f40c4311c84ad4eb913f1322de13",
        "hash_reproducible": true,
        "name": "universal_grounded_reuse_contract",
        "payload_hash": "007cf9fd1a28df0c6d35afca11738f1017bcb82a38f8a0f5fe0d66e9a0e02cb2",
        "present": true,
        "status": "ready",
        "target_level": "RDLLM-L142",
        "version": "rdllm-universal-grounded-reuse-contract/v1"
      },
      {
        "artifact_binding_hash": "9b6da4576931b6773ec3cecc0d37f3a5dc2dd72576acd0dabf16a56e10091d58",
        "declared_hash": "90982909ee231837884a1fd90cb805ba23e8bdeda74d3209feb3c8875a2c5737",
        "hash_reproducible": true,
        "name": "source_footer_delivery",
        "payload_hash": "fc37fa57d1222e209fb68925041a40ff67db7cb02397acb63fc43fe1924c6929",
        "present": true,
        "status": "ready",
        "target_level": "RDLLM-L103",
        "version": ""
      },
      {
        "artifact_binding_hash": "da4130858151d00708e41f5c226021e9c656f4b606334aefc78a55106f78a50f",
        "declared_hash": "e651c5ed4d1069bcf624a4b04c7cda35fa01518f435ff0e063c6b9b31de58ed4",
        "hash_reproducible": true,
        "name": "proof_carrying_response",
        "payload_hash": "847a6e66473edcee58b6a2335f1a681d48726a3a790b67aa5c1da7af8f080130",
        "present": true,
        "status": "released",
        "target_level": "RDLLM-L36",
        "version": "rdllm-proof-carrying-response/v1"
      },
      {
        "artifact_binding_hash": "0849babae89bc131e4e088abf7264f64032c35df8ebf004d0707823dfe671a2a",
        "declared_hash": "b2ccf908f7a6a9846bbe5268025ec6f2d585d8d9e0ec27f8256b4f24c23731be",
        "hash_reproducible": true,
        "name": "response_envelope",
        "payload_hash": "50ed97d811e60b08febfb00cd3b751d4a3fc89951df8837c8b25f19cd98e3460",
        "present": true,
        "status": "verified",
        "target_level": "",
        "version": "rdllm-response-envelope/v1"
      },
      {
        "artifact_binding_hash": "aae2b44de93e3299f8fb050866ab57fca150d5c93dd59e5798aba8825494bc6e",
        "declared_hash": "ca4bf6639b80b98dd0dffcf7b67855a0a9717e22ceca6576df57e0c029346974",
        "hash_reproducible": true,
        "name": "trust_registry",
        "payload_hash": "13b69e349e4e0d309d4ee9af06382b4f8e0a1328d39b33bbfd0d5ab66cb65fc0",
        "present": true,
        "status": "ready",
        "target_level": "RDLLM-L51",
        "version": "rdllm-trust-registry/v1"
      },
      {
        "artifact_binding_hash": "3d0171e49faad7796f1c978ef6a8ed027a4e2961acdcf3c26a7f13f193c8c4c4",
        "declared_hash": "98d71bb8ee99504b9f000419d66d7e7326dc2a4d849f8eddf9837fe17b343ef0",
        "hash_reproducible": true,
        "name": "foundation_model_deployment_attestation",
        "payload_hash": "d090f8544dc8bf7e79e15760915ea48bc1e0d1da5131b16dc506bc8c2cc223c6",
        "present": true,
        "status": "released",
        "target_level": "RDLLM-L129",
        "version": "rdllm-foundation-model-deployment-attestation/v1"
      },
      {
        "artifact_binding_hash": "da39e5ce0ce58c05b494347945ba84b0e37460765630c99abbd81c2108b5a950",
        "declared_hash": "60e336943123017eceea9e444c7b529cd7ff044ce2b6d8024217b0b6bbb62a27",
        "hash_reproducible": true,
        "name": "foundation_runtime_router",